user_input,retrieved_contexts,response,reference,faithfulness,answer_relevancy,context_recall,context_precision
Apa gejala penyakit black rot pada anggur?,"['Penyakit black rot pada tanaman anggur, yang disebabkan oleh jamur Guignardia bidwellii, adalah salah satu penyakit yang dapat menyebabkan kerusakan signifikan pada hasil panen anggur. Penyakit ini ditandai dengan adanya bercak-bercak hitam pada daun dan buah yang dapat berkembang menjadi busuk total, sehingga mempengaruhi kualitas dan kuantitas produksi anggur secara signifikan. G', 'Penyakit utama yang menyerang tanaman anggur adalah downy mildew, atau dikenal sebagai penyakit tepung palsu. Gejala awal dapat terlihat pada daun, yang menunjukkan bintik-bintik kekuningan. \n\nBercak ini akan meluas dan berubah menjadi coklat, menyebabkan daun menjadi kering dan gugur. Jika patogen menyerang buah yang masih kecil, buah tersebut dapat membusuk. Sementara itu, serangan pada buah yang sudah besar dapat menyebabkan bercak coklat seperti kerak.', 'Penyakit daun anggur, dikenal sebagai leaf blight, merupakan kondisi serius yang dapat mempengaruhi kualitas dan hasil panen tanaman anggur. Penyakit ini sering kali disebabkan oleh berbagai patogen jamur, terutama dari genus Botrytis dan Plasmopara viticola, yang berkembang dalam kondisi kelembapan tinggi, menyebabkan gejala seperti bintik-bintik coklat, pengeringan, dan kerusakan pada daun', 'Penyakit daun tanaman anggur yang dikenal sebagai ""brown spot"" atau bercak coklat disebabkan oleh infeksi jamur Alternaria alternata. Penyakit ini ditandai dengan munculnya bercak coklat pada daun, yang dapat menyebabkan kemunduran kesehatan tanaman serta mengurangi hasil panen. Penelitian menunjukkan bahwa penyakit ini berpotensi merusak tanaman anggur secara serius, terutama ketika kondisi lingkungan, seperti kelembapan yang tinggi dan suhu optimal untuk pertumbuhan patogen, hadir.', 'Gambar 14. Penyakit karat daun (Phakospora vitis) pada anggur.\n4. Antraknose (Gloeosporium sp)\nPenyakit ini banyak menyerang buah yang hampir masak, tunas dan cabang- \ncabang muda. Serangan penyakit mula-mula menunjukkan gejala berupa \nbintik-bintik coklat yang meluas dan mengendap ke bawah. Selanjutnya pada \nbagian tengah becak timbul massa berwarna jingga (spora). Pencegahan \ndianjurkan dengan fungisida zirieb, maneb, mankozeb, mankozeb + karben- \ndazim.\n5. Busuk buah (Gray mold)', '. Selain itu, penelitian menunjukkan bahwa pengaplikasian fungisida pada periode dormansi dapat mengurangi intensitas penyakit black rot serta mengendalikan produksi inoculum. Penelitian sortir genetik dan pemuliaan juga sedang berkembang untuk menemukan varietas anggur yang memiliki resistensi terhadap black rot, yang dapat mengurangi ketergantungan pada bahan kimia pengendali penyakit.', 'Secara keseluruhan, pengendalian penyakit black rot memerlukan pendekatan yang terintegrasi dengan memanfaatkan pemahaman tentang epidemiologi penyakit dan karakteristik genetik varietas anggur yang berbeda. Dengan memadukan strategi budaya, aplikasi kimia, dan pemuliaan, petani anggur dapat lebih efektif dalam mengatasi tantangan yang ditimbulkan oleh black rot, sehingga menjaga kualitas dan hasil panen anggur tetap optimal di lapangan.', 'Penanganan black rot umumnya melibatkan pendekatan terintegrasi yang mencakup pengelolaan budaya, pemilihan varietas yang tahan, serta aplikasi fungisida. Praktik pengelolaan budaya seperti memangkas tanaman anggur dan mengatur kesuburan tanah juga telah terbukti efektif dalam mengendalikan penyakit ini. Penggunaan fungisida baru, seperti azoxystrobin dan boscalid, dapat memberikan perlindungan yang lebih baik terhadap penyakit ini', 'Penyakit daun anggur esca, atau yang dikenal dengan istilah black measles, merupakan salah satu penyakit tanaman penting yang menyerang anggur (Vitis vinifera) dan termasuk dalam kategori penyakit batang anggur (Grapevine Trunk Diseases, GTDs). Penyakit ini ditandai oleh gejala seperti bercak coklat pada daun, yang berkembang menjadi pola ""tiger-stripe"" khas dan dapat menyebabkan penurunan kualitas serta kuantitas hasil panen']","Gejala penyakit black rot pada anggur ditandai dengan munculnya bercak-bercak hitam pada daun dan buah. Bercak-bercak ini kemudian dapat berkembang menjadi busuk total pada buah, yang secara signifikan memengaruhi kualitas dan kuantitas hasil panen anggur.","Gejala black rot pada anggur meliputi bercak coklat pada daun, buah mengering menjadi mumi hitam, dan lesi pada batang muda.",1.0,0.9910190091003453,0.0,0.0
